{
  "$schema": "https://changesaga.dev/schema/v5/review-approval.schema.json",
  "version": 5,
  "id": "20260919T035854.281156000Z-50475557",
  "slide": "queue",
  "state": "approved",
  "reviewer": {
    "kind": "ai",
    "name": "Claude 1",
    "agent": "claude-code",
    "model": "claude-opus-5"
  },
  "commit": "0a103972ac26d8dfd8a4a1f3be0b1b9b5a2c4e61",
  "slide_digest": "sha256:abababababababababababababababababababababababababababababababab",
  "body": "Clear transition",
  "created_at": "2026-09-19T03:58:54.281156Z"
}
